text,vision_label,_id,is_neutral
A large herd of black and white cattle in a green field.,descriptive,1,False
a close up of a giraffe near a wooden pole,spatial,2,False
A man wearing a blue and black racing suit racing a blue and black motorcycle. ,descriptive,3,False
a close up of someone siting next to a person operating a laptop,spatial,4,False
"A purple, yellow and orange train passing a platform.",descriptive,5,False
Picture of Middle Eastern diplomats standing side by side.,spatial,6,False
A close up picture of food inside of a pan.,spatial,7,False
a black orange white and black cat is laying in a suitcase,descriptive,8,False
a l=close up of a pair of scissors next to a measuring tape,spatial,9,False
A brightly colored yellow and red fire hydrant on green groundcover.,descriptive,10,False
"parrot that is blue, green, yellow, and red",descriptive,11,False
A man with a turban walks behind his herd of cattle down one side of a street as traffic goes around them.,spatial,12,False
a close up of a drink on a table near a laptop,spatial,13,False
The blue and white train is being moved by a yellow and green vehicle.,descriptive,14,False
A black and white dog wrapped in a white blanket.,descriptive,15,False
some elephants walking across a dirt road close to some mud,spatial,16,False
a close up of a dog walking in front of parked motorcycles,spatial,17,False
a close up of a plate with food next to a wine glass,spatial,18,False
A brown and white horse with a long mane lowering his head to graze.,descriptive,19,False
A black leather couch with red and yellow pillow,descriptive,20,False
a close up of a toilet with a box on top near a wall,spatial,21,False
A woman is laying on here right side and looking up.,spatial,22,False
a close up of a dog on brick surface near a door,spatial,23,False
"A large  white, blue, and red clock shaped like a cup.",descriptive,24,False
a close up of a vase with many flowers inside ,spatial,25,False
A man in black shorts and a black t-shirt holds a black baseball bat.,descriptive,26,False
a blue and red plate with orange segments and a banana on it.,descriptive,27,False
a close up of a cat on a bed next to a laptop,spatial,28,False
A row of up right surfboards inside of a building.,spatial,29,False
a close up of a bench with a blurry background,spatial,30,False
A dog is peering up close while a cat lays on the bed behind him.,spatial,31,False
a blue and white boat and two black and white boats on a shore,descriptive,32,False
Two people walk down a side walk near a fire hydrant.,spatial,33,False
"A large gray elephant walking through a lush green field,",descriptive,34,False
a close up of three giraffes in a structure near a brick wall,spatial,35,False
a close up of a motorcycles handle bars with a speed limit sign in the background,spatial,36,False
a white blue green and  yellow colored bus ,descriptive,37,False
a jeep is driving up along side another vehicle,spatial,38,False
"A person from back-side view, standing with arm out and hand touching head of a sheep with its body toward camera and head towards person, in grass outside with trees in background.",spatial,39,False
A close up of a bicycle with its kickstand down.,spatial,40,False
a close up of a cake on a table near a box of cookies,spatial,41,False
a close up of two people walking close together,spatial,42,False
a close up of a cup of drink with plates of food near by,spatial,43,False
An airplane is flying close to the lake of water below. ,spatial,44,False
A beige and red and a blue and green and white train,descriptive,45,False
"The flowers, in the black with green/gold strip vase, is mostly white and black.",descriptive,46,False
A large room with all white furniture and dark wood floors.,descriptive,47,False
A close up of an elephants left side face and snout. ,spatial,48,False
A church with a large fire place and a large white table.,descriptive,49,False
A round red sign that shows a silhouette of a person carrying a large white rectangular object.,descriptive,50,False
a close up of a bench near a tree ,spatial,51,False
"A nearly all black snapshot shows a man standing sideways and looking forward, who is wearing a dark coat and hat and a bright pink tie. ",descriptive,52,False
A boy walking down the street in front of some buses parked in the middle of the street,spatial,53,False
a gray black and white cat a monitor and a laptop and keyboard,descriptive,54,False
vase with flowers make up the center piece of table in front of window,spatial,55,False
A small bathroom with white tile on the walls and a white vanity and sink.,descriptive,56,False
Two guys on a side walk near neon lights with a little bicycle with training wheels in front of them.,spatial,57,False
A close up image of the inside of an open umbrella.,spatial,58,False
A brown teddy bear sitting by a blue and white cup of coffee.,descriptive,59,False
a close up of a hot dog near a fork ,spatial,60,False
"A basketball court with the head coach dressed in a suit and standing on the court, with a player near him and event staff close by.",spatial,61,False
close up view of a pizza on a table near a glass of wine,spatial,62,False
The top of a cats head peaking above some covers and behind it a full bookcase.,spatial,63,False
A man fliped up side down while wind surfing.,spatial,64,False
A policeman on a bike is driving along and people in uniform are lined up along the side of the road.,spatial,65,False
A close-up of a bear's head just above the water.,spatial,66,False
a close up of plants behind a shade ,spatial,67,False
a cargo train going down a track close to the free way ,spatial,68,False
"Beach scene, two blue chairs with yellow umbrella, slight overcast blue sky and green-blue ocean.",descriptive,69,False
Trains stopped along a side walk near a building.,spatial,70,False
broken red umbrella laying in tall green grass,descriptive,71,False
"A large gray dog with a red frisbee in his mouth, and a thought bubble.",descriptive,72,False
Large forbearance small polar bear standing on white concrete block. ,descriptive,73,False
a black and brown dog and a white and orange cat ,descriptive,74,False
a close up of a street sign with a plane in the background,spatial,75,False
A trash can sitting next to a bench outside with a trash bag next to it . ,spatial,76,False
The bathroom is in white and shades of green with green plants.,descriptive,77,False
A black and white cat pokes its head from under a green garage door.,descriptive,78,False
There is a small bird with a pale yellow head and a mottled blue gray body.,descriptive,79,False
A long yellow and red bus is crossing the street.,descriptive,80,False
"This donut has blue, green, and yellow confetti with white frosting on it.",descriptive,81,False
Two computer screens showing black wings on a white screen and white wings on a black screen.,descriptive,82,False
a close up of an open computer next to a keyboard,spatial,83,False
One white and black sheep and one brown and black sheep,descriptive,84,False
A large black bird with a large orange  beak sitting on a rope.,descriptive,85,False
a close up of two giraffes standing near one another ,spatial,86,False
three black dogs a white dog and a white clock,descriptive,87,False
A close up of a partial hotel sign with a building in the background.,spatial,88,False
Picture of a clean white bathroom sink with black handles.,descriptive,89,False
a red and white jet on a runway and brown grass,descriptive,90,False
Two middle aged men eating pizza outside in front of mountains.,spatial,91,False
a close up of three older men standing near one another,spatial,92,False
A man with long hair wearing a jacket and purple and blue tie.,descriptive,93,False
A view of a couch from across the room. A man is sitting in a chair to the far right.,spatial,94,False
A red and white airplane streams blue smoke through a gray sky.,descriptive,95,False
A stone wall with ivy growing across it and a clock tower above it with a weathervane on top of the clock tower.,spatial,96,False
A brown and white horse grazing on lush green grass.,descriptive,97,False
Blue and yellow labels stand out against the bright yellow bananas.,descriptive,98,False
a bus pulling up in front of a bus pick up spots ,spatial,99,False
"A man in a black wet suit is on a bright, yellow surfboard riding a small wave in the ocean.",descriptive,100,False
"Dog moving in  brown colored water, holding dark yellow Frisbee, with Coca Cola red canopy and people on water bank.",descriptive,101,False
A close up of a giraffe picture wrapped around a tree next to a parking meter.,spatial,102,False
a bunch of cement blocks stacked side by side in front of umbrellas,spatial,103,False
The large brown and dark brown cat is looking straight ahead.,descriptive,104,False
a close up of a number of zebras behind a fence,spatial,105,False
a close up of a sign on top of a urinal ,spatial,106,False
"Legs with striped black socks, black shoes and a red and white Pokka dot umbrella on the floor.",descriptive,107,False
a close up of a person holding food with bikes in the background,spatial,108,False
A close up of a keyboard on a wooden desk top next to a computer monitor. ,spatial,109,False
A man in a white and black checkered shirt with a black tie and black wool vest.,descriptive,110,False
a small blue seated toilet in a small room,descriptive,111,False
A train traveling very close to houses next to a street.,spatial,112,False
A man in blue shirt and black pants catching a yellow frisbee.,descriptive,113,False
A tall black and white horse standing on a lush green field.,descriptive,114,False
a close up of a giraffe behind a fence,spatial,115,False
a brown and black ox and a white and black one and grass ,descriptive,116,False
"A boy from the back with arms up and hands on top of railing, looking over fence with a standing giraffe from back diagonal view and a lying down giraffe from back diagonal with neck and head raised, in grass near building.",spatial,117,False
The train is travelling down the tracks and is close to the buildings.,spatial,118,False
The picture captures a close up of one side of an old Greek vase.,spatial,119,False
Ten channel selectors that have green and red buttons a huge round button and numeral numbers.,descriptive,120,False
A bright living room with white and gray wallpaper.,descriptive,121,False
A close up shot of broccoli and meat with butter on top.,spatial,122,False
Police officers on their bikes lined up behind one another on the side of the road. ,spatial,123,False
"A view of a colorful salad featuring green onions, yellow carrots, and orange peppers. ",descriptive,124,False
Two giraffes walking side by side near a wall.,spatial,125,False
some blue yellow and white pots with white plants in them,descriptive,126,False
a red black brown and white bird on a branch,descriptive,127,False
"Several tennis courts are dotted mainly with children, although one man with a racket is standing and smiling in the direction of a boy on the opposite side of the net in front of him.",spatial,128,False
Close up view of the under carriage of a jet in the sky with landing gear down.,spatial,129,False
close up of a giraffe eating with a ence in the background,spatial,130,False
A large white and red boat traveling with lots of passengers.,descriptive,131,False
A toddler holds scissors up in the air around a big mess of cut up paper.,spatial,132,False
Small yellow and orange flowers are arranged in a cobalt blue vase.,descriptive,133,False
"A colorful lunch sits on red plate on a blue tray, all on a white table.",descriptive,134,False
A man wearing glasses brushing his teeth up close to the camera ,spatial,135,False
a close up of a giraffe with a hill in the background,spatial,136,False
a close up of a vase with art behind a display glass,spatial,137,False
A large bunch of white and green flowers with green stems.,descriptive,138,False
A tanker truck driving down a road with two people riding an elephant on the side of the road behind the passing truck.,spatial,139,False
A brown and white zebra is in tall grass grazing.,descriptive,140,False
Large brown cow standing in field with small cow. ,descriptive,141,False
a close up of two elephants in a field with trees in the background,spatial,142,False
"A traffic light glows green, yellow, and red all at the same time.",descriptive,143,False
A red white and blue motorcycle in a garage. ,descriptive,144,False
a brown and black horse some people and a red and black cart,descriptive,145,False
a close up ofa set of steps on top of a building,spatial,146,False
"A small man in a yellow jacket, white shirt and black shorts, holding an umbrella with a larger man who is dressed the same seated nearby.",descriptive,147,False
A man is wearing a blue shirt with a black coat and a gold tie.,descriptive,148,False
two black and white clocks a tan building and a white and blue bus ,descriptive,149,False
a top and bottom view of a sandwhich with eggs and other vegetables next to it,spatial,150,False
An open white toilet against a wall of white tiles and a black and white floor.,descriptive,151,False
The gold tie looks especially bright against a dark shirt.,descriptive,152,False
a close up of a dog on the ground next to a toy,spatial,153,False
a chair a black desk a black gray and white cat,descriptive,154,False
A side of a house next to a sidewalk near a street.,spatial,155,False
A tall white and red light house sitting on a green hill.,descriptive,156,False
some people skiing down a trail close to a resort ,spatial,157,False
Large white and red Japan Airlines plane on tarmac.,descriptive,158,False
"Fire hydrant in red, white, and blue in black and white photo with toddler",descriptive,159,False
a red black and white parked motorcycle and trees,descriptive,160,False
"A wreath with red and green, and solid red fabric hanging from a door.",descriptive,161,False
A black and white picture of a black and white street sign.,descriptive,162,False
A man snowboarding down a mountain top near trees.,spatial,163,False
"A street with parked cars along curb of one side, one of which is a police car near a fire hydrant.",spatial,164,False
a black and red brick building with a white and black clock and sign,descriptive,165,False
A close up image of a man outside on a cloudy day. ,spatial,166,False
A close view down the side of a jet airplane with a Canadian flag on the side.,spatial,167,False
A woman sitting on a blue couch with a white sweater and a white dog. ,descriptive,168,False
"A small brown, gray and black bird on a mossy surface.",descriptive,169,False
Multiple bicycles parked side by side next to a busy street.,spatial,170,False
"A pair of green, yellow and orange skis.",descriptive,171,False
A man with a white shirt and white cap is holding a tennis racket while playing on a green court.,descriptive,172,False
a black white yellow blue green and red kite and a person,descriptive,173,False
Many people walk around and sit in beach chairs next to the ocean near the city.,spatial,174,False
A white toilet with blue writing and a brown toilet seat cover.,descriptive,175,False
a close up of a bear in a field near bushes,spatial,176,False
a small clean bathroom with a blue towel and a white wash cloth,descriptive,177,False
"A large red and yellow fire truck passed by a white car,",descriptive,178,False
A center island inside of a kitchen next to a sink.,spatial,179,False
"A brown, white and black bird flying in blue sky.",descriptive,180,False
a close up of a street sign with trees in the background,spatial,181,False
A small beige living room with a chair and gray tv.,descriptive,182,False
"A man ""popping a wheelie"" on a blue and white motorcycle while wearing a red and white helmet. ",descriptive,183,False
A large white polar bear holding onto an object while floating in blue water.,descriptive,184,False
a close up of a hot dog near a can of soda,spatial,185,False
a close up of a fire hydrant on a side walk,spatial,186,False
a close up of a bear in a field near trees and bushes,spatial,187,False
a small girl in a brown and pink dress and a brown cake with two candles,descriptive,188,False
The two birds are standing close together beside the water. ,spatial,189,False
A green vase filled with purple and white long stem flowers.,descriptive,190,False
two zebras close to one another inside of a fence,spatial,191,False
an extreme close up of the bottom of a skate board,spatial,192,False
some black and white cows in a green and yellow field,descriptive,193,False
Two sailboats in the middle of a body of water with sunset in background and two other boats near by.,spatial,194,False
A zebra in front of a fence beside another zebra on the other side of the fence.,spatial,195,False
A large black dog is laying on a white comforter.,descriptive,196,False
Close up of a tree ornament with a clock tower in the background.,spatial,197,False
Large wood and glass armoire  in small green walled room. ,descriptive,198,False
A frisebeedisc standing up along side other objets.,spatial,199,False
A close-up of vegetables and dressing on top of the pizza.,spatial,200,False
View down latter shows luggage sitting next to side of boat,spatial,201,False
A black and white photograph of a white man with a large tie. ,descriptive,202,False
A sandwich sitting on top of a plate next to sliced up bread.,spatial,203,False
A large brown dog with a white deflated ball in it's mouth.,descriptive,204,False
This otherwise black-and-white photo has a dark-shirted man's necktie colored light blue.,descriptive,205,False
a close up of a street sign with trees in the background,spatial,206,False
"A yellow, black, white and blue bird sits on the branches of a tree.",descriptive,207,False
A silver and black blender with white and red liquid.,descriptive,208,False
"Two Giraffe graze in the field, side by side, in front of some barren trees.",spatial,209,False
"A tiny, narrow bathroom is situated by a tiny, narrow kitchen.",descriptive,210,False
A small kitchen with green and yellow cabinets and black stove and refrigerator.,descriptive,211,False
a white and black cat and a brown and white dog ,descriptive,212,False
Three police officers riding motorcycles side by side down a city street.,spatial,213,False
The large truck is painted bright green and orange.,descriptive,214,False
"Front diagonal view of commuter train on tracks, outside between platforms.",spatial,215,False
a close up of a toilet near a stand up shower,spatial,216,False
Close up from behind of a young giraffe standing with front legs splayed and head the ground by a fence outside.,spatial,217,False
a close up of a stop sign next to a building,spatial,218,False
White toilet in blue and white bathroom with black bucket.,descriptive,219,False
a black and white dog and a brown and white dog both on leashes,descriptive,220,False
a close up of a pair of scissors near some material ,spatial,221,False
"A white and black kitchen features a black stove, a black refrigerator and white cabinets.",descriptive,222,False
a close up of an air planes wing with mountains in the background,spatial,223,False
A dark colored tie features a tiny pin with a red cross.,descriptive,224,False
a close up of a street sign with a sky background,spatial,225,False
a close up of a street sign with trees in the background,spatial,226,False
A close up photo of a zebra outside during the day.,spatial,227,False
A small white dog riding a small blue bike.,descriptive,228,False
a close up of two cats inside of a refrigerator,spatial,229,False
A close up of an elephant behind inside a cage.,spatial,230,False
There are some giraffes laying down next to a giraffestanding up.,spatial,231,False
Large circular shaped clock tower in black and white.,descriptive,232,False
A small blue and red tug boat on the water,descriptive,233,False
a close up of a bear with a blurry background,spatial,234,False
A close up view of a giraffe in front of a palm tree.,spatial,235,False
A close up of a toilet with a mosaiced top.,spatial,236,False
two ladys sitting side by side with one holding a pastry up too her mouth,spatial,237,False
"a plain donut covered with red, white, and blue sprinkles",descriptive,238,False
A large elephant wearing a red costume covered in purple lights,descriptive,239,False
Pots on top of a stove next to a counter top.,spatial,240,False
A small white and brown dog laying on the floor.,descriptive,241,False
a close up of a cow near some buildings ,spatial,242,False
A large black and white horse has long hair.,descriptive,243,False
A large herd of black and white cows with yellow tags in their ears.,descriptive,244,False
a close up of a zebra on a field near a path,spatial,245,False
Several cars and a double-decker bus stopped at a bus stop in front of a Barclays building are in country where vehicles drive on the left side of the road.,spatial,246,False
Remote control close up shot with television in background.,spatial,247,False
a close up of a vase with trees in the background,spatial,248,False
two elephants standing side by side next to some bushes,spatial,249,False
A smiling man with dark hair and a beard wearing a dark suit and blue tie. ,descriptive,250,False
a close up of a bus parked in a lot near another car,spatial,251,False
a close up of a bird next to a backpack,spatial,252,False
Two pictures side by side of a man holding a tennis racket in front of a tennis ball. ,spatial,253,False
a close up of a doughnut near a drink ,spatial,254,False
A teen boy wearing black and white performing tricks with a yellow Frisbee while another boy watch. ,descriptive,255,False
A white dog laying on green grass with a red frisbee.,descriptive,256,False
A tall man and a short child standing on a white and black tennis court.,descriptive,257,False
"A small bathroom with a toilet, sink, and red and yellow shower curtain.",descriptive,258,False
"A black bird with an orange, red, and yellow beak swims in the water.",descriptive,259,False
a stained glass window with colors of red blue green and white,descriptive,260,False
"A cake with green, red and yellow frosting and a large black ornament.",descriptive,261,False
"Colorful view of the ocean with ships, blue sky, water, and red and blue beach umbrellas.",descriptive,262,False
A giraffe is walking along the field in the far distance as hippos are laying the grass in the foreground.,spatial,263,False
a close up of a stove in the middle of a room,spatial,264,False
A close-up view of a hand placed near the muzzle of a horse. ,spatial,265,False
"A bathroom with green walls, white towels and black and white tile floor.",descriptive,266,False
A large black steer walking away with a small stuffed teddy bear in a pile of brush.,descriptive,267,False
A long narrow kitchen includes a bright ceiling and back wall.,descriptive,268,False
A person sitting at a table that has a blue checked tablecloth on it and a large round pizza that is uncut.,descriptive,269,False
a close up of a fire hydrant near many flowers,spatial,270,False
a red green blue and white train and tracks,descriptive,271,False
A close up of a person standing next to a horse.,spatial,272,False
"A red, white, and blue kite sails through the blue sky.",descriptive,273,False
"Baseball players siting in a dugout area look out at home base, which rests in the foreground, and shows a  batter finishing his swing, a crouching catcher and an umpire right behind him. ",spatial,274,False
a close up of a zebra on a field near a fence,spatial,275,False
A close up of an umbrellas with cars and people in the background.,spatial,276,False
A colorful garden with purple and white flowers.,descriptive,277,False
a close up of a person sitting down with an aumbrella,spatial,278,False
a close up photo of a pepperoni pizza next to a pamplet,spatial,279,False
Seats are lined up along the side of a wall. ,spatial,280,False
"A brown, black and white vase holding orange and white flowers.",descriptive,281,False
A young child laying down in bed with one arm raised up that is wrapped up.,spatial,282,False
Two trains move side by side in the middle of a field,spatial,283,False
a group of women gathered together side by side in front of a table with pastries on it,spatial,284,False
A bus broke down on the side of the highway and all the passengers had to file out onto the side of the road.,spatial,285,False
A black and white cat has long white whiskers.,descriptive,286,False
a bunch of fruit sitting side by side being sliced down the middle,spatial,287,False
A green kitchen with a white stove and silver refrigerator.,descriptive,288,False
a close up of a bowl of food near a cup,spatial,289,False
Two bed sitting beside each other with a side table between them.,spatial,290,False
"Someone wearing a white helmet, a black wet suit and water skis in blue water.",descriptive,291,False
a male surfer in a blue shirt is carrying a yellow and red board,descriptive,292,False
a close up of a street sign with trees in the background,spatial,293,False
some green yellow black white and orange birds and some plants,descriptive,294,False
a green vase of purple flowers with long stems on a white clothed table.,descriptive,295,False
A man wearing a tie with large circles in bright red.,descriptive,296,False
a close up of a zebra next to a tree,spatial,297,False
A person with bright red hair and shirt using a black umbrella.,descriptive,298,False
"The large motorboat is painted yellow, grey, and white.",descriptive,299,False
a close up of an analog clock on a pole with a building in the background,spatial,300,False
A well made up bed with lamps above and around it.,spatial,301,False
A bus pulling up in a outdoor environment with another bus close behind it.,spatial,302,False
a close up of two zebras near one another near trees,spatial,303,False
"A white computer desk with a black monitor, a blue lava lamp and a small black fan. ",descriptive,304,False
