text,vision_label,_id,is_neutral
a white gray and black cat is sleeping on a shoe,descriptive,1509,False
"A bathroom is white with a blue, black, and white floor.",descriptive,1510,False
Boys standing in front of microphones outside in front of cameras. ,spatial,1511,False
Surfer at the top of a wave kicking up water behind him. ,spatial,1512,False
"A silver, red, and yellow train approaching on the tracks. ",descriptive,1513,False
"A train station with a red,white yellow and blue train pulling in on the tracks",descriptive,1514,False
a elephant walking down a rode with a car not far behind ,spatial,1515,False
A large white and green airplane sits at a gate.,descriptive,1516,False
A orange and white cat with large blue eyes.,descriptive,1517,False
A yellow tie stands in contrast to the black and white image of a man wearing glasses.,descriptive,1518,False
a close up of a giraffe near many trees,spatial,1519,False
A white-tiled bathroom features black accents and black and white patterned tiles.,descriptive,1520,False
Two small puppies are eating from a food dish and one of the puppies is gray and white while the other is black and white.,descriptive,1521,False
a close up of a truck with another truck behind it,spatial,1522,False
A hand holds a blue and white toothbrush over a silver handle on a white sink.,descriptive,1523,False
White flowers on gray fabric and a small white horse.,descriptive,1524,False
a bedroom with a white chair a table and a brown blue and white bed,descriptive,1525,False
A large green red and white airplane on the runway. ,descriptive,1526,False
A large airplane flies through the bright blue sky. ,descriptive,1527,False
Black and white photograph of small bears approaching an automobile,descriptive,1528,False
"A red and white sign reading ""Whoa"" and a red a white sign reading ""Caution children at play"".",descriptive,1529,False
a white and black horse and some people in a red and yellow cart,descriptive,1530,False
three oranges sliced up and laying side by side,spatial,1531,False
Two grown elephants in the middle of the habitat and a baby elephant right behind them.,spatial,1532,False
a black and white clock on a black building,descriptive,1533,False
a silver car and some yellow white and blue umbrellas,descriptive,1534,False
A train departs one one side of the tracks as people wait on the opposite side.,spatial,1535,False
A person is lifting up the top bun of their sandwich to see what is inside.,spatial,1536,False
a close up of a cat near a bowl on the ground ,spatial,1537,False
A paddle boat near some steps close to a light tower.,spatial,1538,False
a close up of a stop sign in front of some trees,spatial,1539,False
A train going down the track with steam on top and a bicyclist riding beside it.,spatial,1540,False
a close up of two zebras near rocks and a building,spatial,1541,False
a close up of a giraffe on dirt ground near a bush,spatial,1542,False
some people and cars at the beach and a green black red and white kite,descriptive,1543,False
a close up of a bird on one foot near a wall,spatial,1544,False
A transport truck traveling down a road next to a dried up field.,spatial,1545,False
"One zebra lying down side view with head up angle toward camera and the back view of two other zebras standing behind it and a few feet apart from each other, with wall behind and tree.",spatial,1546,False
a close up of a vase in front of a clock on a desk,spatial,1547,False
A kitchen decorated in white and black colors and a gray floor.,descriptive,1548,False
"A lamb, front diagonal view, laying in a shady area of sunny grass, with front half of a sheep looking at camera on right side of photo.",spatial,1549,False
A purple umbrella floating in blue and green water.,descriptive,1550,False
We are looking at a single colorful umbrella in an otherwise black and white photo.,descriptive,1551,False
a close up of a pizza on a pan near a drawing,spatial,1552,False
FOUR TELEVISION REMOTES KEPT SIDE BY SIDE IN FRONT OF TWO TELEVISIONS. ,spatial,1553,False
A close up picture of a vase in front of 6 other vases.,spatial,1554,False
a gray black and white cat is sitting on a brown cabinet,descriptive,1555,False
Shot of bathroom with bath on far side near toilet.,spatial,1556,False
a close up of a number of sheep with a tree in the background,spatial,1557,False
"A view looking out from the inside of a car window at an intersection, with a truck and a car at the opposite side of the street.",spatial,1558,False
Large group of yellow and green bananas on display in a market. ,descriptive,1559,False
"A man is holding up a blackberry phone in a crowd of people in front of a stage with two men on it, one behind a podium.",spatial,1560,False
"A brown, gray and black motorcycle at a bike show.",descriptive,1561,False
A close-up of a restaurant sign attached to the side of a building.,spatial,1562,False
"Patriotic red, white and blue airplanes perform maneuvers in the sky.",descriptive,1563,False
A large brown bear standing in a  lush green forest.,descriptive,1564,False
a brown and white horse and a white and black horse,descriptive,1565,False
A man in a red blue and green plaid shirt wears a hideously ugly tie.,descriptive,1566,False
A bright clean bathroom where everything is white except the counter.,descriptive,1567,False
A small white and brown dog holding a piece of pizza in it's mouth.,descriptive,1568,False
"A multi colored kite with a red, white, and black mask on it.",descriptive,1569,False
A large white and blue airplane flying through a blue sky.,descriptive,1570,False
The outside of the South Street City Oven and Grill along with its clock. ,spatial,1571,False
a a close up ofa zebra in a field with a building in the background ,spatial,1572,False
a close up of a pizza with a fountain in the background,spatial,1573,False
a close up of a street sign with a sky background,spatial,1574,False
A room with a couch up close and a table in the background.,spatial,1575,False
A close up of a crosswalk sign in the middle of the road.,spatial,1576,False
"A man wearing a bright yellow shirt, black shorts and white cap getting ready to hit the tennis ball with his racket.",descriptive,1577,False
Two pizzas in boxes side by side with plastic stand in middle of each.,spatial,1578,False
a close up of a remote control with a blurry background,spatial,1579,False
a close up of a pitcher and a vase with a flower inside,spatial,1580,False
"A man at the beach flies a red, white and blue kite.",descriptive,1581,False
The TV is close to the dresser which is close to the window.,spatial,1582,False
four different suitcases red blue brown and black colors,descriptive,1583,False
"Two double decker buses proceed down the street, side by side.",spatial,1584,False
A close up of a sign with the ocean in the background.,spatial,1585,False
An old man holding a large blue and white surfboard.,descriptive,1586,False
A surfboard propped up on the sand at a beach in front of buildings and a surfer walking by along the water.,spatial,1587,False
a cheese pizza on a white plate with red green and black toppings,descriptive,1588,False
some light brown and dark brown and black and white goats,descriptive,1589,False
A small blue and yellow bathroom with a bidet.,descriptive,1590,False
"The large plane is painted orange, blue, green and red.",descriptive,1591,False
A dirty red fire hydrant sitting in a dark room,descriptive,1592,False
a close up of a street sign in front of a building,spatial,1593,False
"A green, white, and red airplane is being loaded.",descriptive,1594,False
A dog is crouched down beside a toilet looking up at the paper.,spatial,1595,False
A close up of a horse on the beach with people in the background.,spatial,1596,False
some white black blue and red signs and a building,descriptive,1597,False
Top down view of the inside of a lego creation.,spatial,1598,False
"A blue, yellow, red and white plane at a fueling station.",descriptive,1599,False
"A blue-green, pea green and tan-green bus driving out of a garage.",descriptive,1600,False
a close up of a horse eating grass near a tree,spatial,1601,False
a close up of a zebras teeth with a horse near by,spatial,1602,False
a close up of a street sign with trees in the background,spatial,1603,False
"A small room features a small bed with a red, white and green blanket while pictures hang on the papered wall.",descriptive,1604,False
A remote control viewed close-up with a television screen in the background. ,spatial,1605,False
"Two elephants from side standing one in front of another in an outdoor natural enclosure with rocks, dirt and trees, and a group of people looking at them in the distance from other side of a wall.",spatial,1606,False
"Dozens of open red,  yellow and green umbrellas.",descriptive,1607,False
"The black, white, and grey dog is jumping to catch a yellow Frisbee.",descriptive,1608,False
A close up of a giraffe from the neck up,spatial,1609,False
an orange black and white cat looking at a white plate and a black and gray cat and a BBQ grill,descriptive,1610,False
a close up of a cat laying on the side of a road ,spatial,1611,False
A close up of a school bus parked on the side of the road.,spatial,1612,False
a close up of a clock near a wall ,spatial,1613,False
Skiers near the top of a ski slope near ski lift.,spatial,1614,False
A train traveling down the train tracks along the country side. ,spatial,1615,False
A white vase with pink flowers and large green stems.,descriptive,1616,False
A small twisted blue and green pitcher with a large handle.,descriptive,1617,False
a close up of a street sign near a city street ,spatial,1618,False
two different buses one is white and blue the other red and white,descriptive,1619,False
A close up of a parking meter on the side of the street.,spatial,1620,False
Several toilets lined up near each other sitting outside.,spatial,1621,False
The surfer with black and blue outfit rides the wave with his blue and white surfboard.,descriptive,1622,False
a close up of a cat laying down ,spatial,1623,False
A small narrow bathroom with white and black flooring,descriptive,1624,False
A close up view of fire hydrant on top of a sidewalk.,spatial,1625,False
a man wearing bright green pants and black coat skiing ,descriptive,1626,False
a close up of a cat on the ground near a nintendo remote,spatial,1627,False
An elephant and it's child walking side by side near a forest of palm trees..,spatial,1628,False
a close up of a street sign with people walking near by,spatial,1629,False
"A living room area features a large window, a white couch, a small table and a large area rug.",descriptive,1630,False
a close up of a cat on top of a bag on the ground,spatial,1631,False
A large body of water with a small sailboat red and white mast,descriptive,1632,False
A blue room with a brown double door and a closet full of clothes with a pink television on a stand.,descriptive,1633,False
A father and son pose together side by side in front of a brick wall.,spatial,1634,False
A close up of a plane passing overhead.,spatial,1635,False
A large brown bear walking through a lush green forest.,descriptive,1636,False
two street signs one is green and white the other brown and white,descriptive,1637,False
a woman wearing a black and white dress is leaning against a silver fire hydrant,descriptive,1638,False
Black and white large cat balloons and a red lizard large balloon.,descriptive,1639,False
A green bed with white bedding in a room with green striped walls.,descriptive,1640,False
a yellow black purple white and blue train and tracks,descriptive,1641,False
It's a black and white photo of a street corner in a large city.,descriptive,1642,False
Two Animals side by side behind a wired fence.,spatial,1643,False
a close up of two cats near one another ,spatial,1644,False
A small bathroom with a blue toilet and a white vanity and black and white tiles.,descriptive,1645,False
"Front diagonal view of twin boys, standing, one holding kite string, looking over their shoulders a kite with three tails low in air, but slight higher than their height,  near them, outside in the grass.",spatial,1646,False
A large gray elephant with huge white tusk.,descriptive,1647,False
Two small white dogs looking out small windows of a building.,descriptive,1648,False
Small child in white shirt holding a white controller. ,descriptive,1649,False
Woman with dark black'blue hair wearing a huge black and white diamond striped tie.,descriptive,1650,False
a close up of a group of zebra standing near one another,spatial,1651,False
some red white and blue planes and men in blue shirts,descriptive,1652,False
a close up of doughnuts on display behind a glass,spatial,1653,False
a giraffe standing close to a fence while people stand around ,spatial,1654,False
two orange green red yellow and black vases,descriptive,1655,False
"A large room features a bed with a red cover, a television set, a black table and a white kitchen area.",descriptive,1656,False
"A guy in a blue shirt, black tie, dark pants and his hands in his pockets.",descriptive,1657,False
a black and white zebra is eating some green grass,descriptive,1658,False
a white pot with orange red purple and white flowers,descriptive,1659,False
Small white bathroom with purple towels and bright lights. ,descriptive,1660,False
A very large blue and white vase sitting on a purple counter.,descriptive,1661,False
A black and white cat eating out of a white coffee cup.,descriptive,1662,False
a close up of people next to a table with plates,spatial,1663,False
a close up of a plate of food near a bottle ,spatial,1664,False
A small boy in a red and white shirt and black cap holding a toothbrush in his mouth.,descriptive,1665,False
A close-up of a clock on the wall with the train plaque below.,spatial,1666,False
Three adult brown and white giraffes and one brown and white baby giraffe,descriptive,1667,False
A close up of someone putting their feet up on a pile of luggage. ,spatial,1668,False
a close up of a fire hydrant on a city side walk,spatial,1669,False
"BLACK, BLUE, WHITE, RED, ORANGE RED AND YELLOW AIRPLANE",descriptive,1670,False
A tall purple vase with purple and pink flowers.,descriptive,1671,False
a close up of sliced apples and bananas near one another,spatial,1672,False
Close up of a bunch of oranges with some on a plate in the background.,spatial,1673,False
a red blue and black tie and a blue shirt and trees,descriptive,1674,False
a white red black and blue truck and a white house,descriptive,1675,False
a white living room with a red lamp and black couch,descriptive,1676,False
One boy in a blue shirt and white pants runs as a boy in white pants and a green shirt holds out a baseball mitt toward him.,descriptive,1677,False
a brown black and white dog and a black cat on a bed,descriptive,1678,False
a large green silver and black machine and windows,descriptive,1679,False
a red and black miniature train engine is pulling a red train car,descriptive,1680,False
"A woman in a colorful outfit is surrounded by yellow, green and orange feathers.",descriptive,1681,False
"A thick evergreen forest marks the boundary of a dark expanse of water, on which rests a long boat with packages at the rear and people to the fore, several holding long oars. ",descriptive,1682,False
Small black and white dog sitting on the floor looking at table. ,descriptive,1683,False
Small boy in green shirt touching a yellow fire hydrant. ,descriptive,1684,False
a male with a black tie and a boy in a red white and black shirt,descriptive,1685,False
Three giraffes spend time near trees while some different animals in the background have their heads behind a rock.,spatial,1686,False
Close up of computer keyboard and bottom of Apple monitor.,spatial,1687,False
"A motorcycle and side car from front diagonal view, on concrete, with two senior men sitting at a table behind, and a walkway park area with trees, flowers, bushes and a gazebo in the background.",spatial,1688,False
"A white, brown and gray long haired cat sitting on a window ledge.",descriptive,1689,False
a black and white photo with two black and white zebras,descriptive,1690,False
A small red and white airplane in an airfield,descriptive,1691,False
some green yellow and red apples in baskets,descriptive,1692,False
"Room with two twin beds made up same way against wall with bedside table to right of each, a table lamp, and a sliding glass door with curtains to one side.",spatial,1693,False
a black brown and white cat an orange leash and a bicycle,descriptive,1694,False
two cats one is black gray and white and the other is orange and white ,descriptive,1695,False
A miniature statue of a gold cupid holding a gold and blue clock.,descriptive,1696,False
"A man with an orange and pink surfboard, a man in a white shirt and jeans and a woman in gray and black with a white surfboard cross a street in the crosswalk.",descriptive,1697,False
This is a black striped neck tie with a white shirt and black jacket. ,descriptive,1698,False
Two peeled carrots next with cut up squash and cut up carrots next to them.,spatial,1699,False
A close up view from behind a baseball player at home plate.,spatial,1700,False
A bathroom with pink walls and a white and brown toilet.,descriptive,1701,False
some brown white and black cows water and grass,descriptive,1702,False
"Sheep, one in mixed brown and white fleece and long horns, the other in beige fleece grazing on grass.",descriptive,1703,False
Small clean white kitchen area with dark appliances.,descriptive,1704,False
A brown and white dog chasing a blue and yellow frisbee.,descriptive,1705,False
a close up of many different items on table with a cloth on top,spatial,1706,False
some people walk down a side walk in front of some buildings,spatial,1707,False
"A green, red, white and blue train in on the train track.",descriptive,1708,False
A large brown and yellow bathroom trimmed in pink.,descriptive,1709,False
"A man parasailing with a bright red, orange, and yellow sail on the ocean.",descriptive,1710,False
Four zebra are standing close together beside a tree.,spatial,1711,False
Motorcycles are lined up outside along the street. ,spatial,1712,False
A brown tie with yellow spots matched with a grey vest and a white shirt.,descriptive,1713,False
Several elephants in the water with one up close standing next to a trainer ,spatial,1714,False
A girl balancing an over sized tennis ball on a racket while a man and woman walk side by side behind her.,spatial,1715,False
a man in a blue shirt and red hat and a crate of yellow apples,descriptive,1716,False
"The message on the wall is ""Live Laugh Love"", in the clean, ultra-modern office with red, white and black decor.",descriptive,1717,False
a small yellow boat set in the water by large rocks,descriptive,1718,False
a black gray orange and white cat and a white cup ,descriptive,1719,False
"Small living room area with blue carpet, blue couches, and a small fireplace. ",descriptive,1720,False
A group of giraffes roam free on a plain with tall brown grass and green bushes.,descriptive,1721,False
A close up of a stop sign with cars in the background.,spatial,1722,False
Two small white flower vases that are sitting on a brown table.,descriptive,1723,False
A girl in white and black clothes riding a large black house.,descriptive,1724,False
"A small blue, brown and white bird sitting on a branch.",descriptive,1725,False
People standing near two furry dogs close to a rail.,spatial,1726,False
a close up of a bed with a laptop near by,spatial,1727,False
a close up of dog and a dog near a stuffed animal ,spatial,1728,False
"A blue, green, black and white shuttle bus and cars on road",descriptive,1729,False
a close up of a train on a track with trees in the background,spatial,1730,False
A long stem yellow rose set in a tall blue vase,descriptive,1731,False
"A bathroom with a toilet, small red trash can and green slippers. ",descriptive,1732,False
some buses green yellow red white and blue colors,descriptive,1733,False
A large red double decker bus driving past tall buildings.,descriptive,1734,False
a boy a red ball and a red and white fire hydrant,descriptive,1735,False
A lone bench next to a trail high up on a hill side.,spatial,1736,False
some red white yellow and blue buses and some buildings,descriptive,1737,False
A colorful purse with a black strap atop a red shelf.,descriptive,1738,False
A close up of the top of a toothbrush.,spatial,1739,False
a person close top a fence with many sheep,spatial,1740,False
"A red and white sign against a gray wall, a clock is also attached to the gray building.",descriptive,1741,False
"Side view of a man standing by and elephant with trunk raised to two women standing together on deck at top of stairs, outside.",spatial,1742,False
A stove top oven sitting below a window near a table.,spatial,1743,False
"A kitchen contains black countertops, brown cabinets, and a red and white tile blacksplash.",descriptive,1744,False
A black and white cat sits with an open black and green purse.,descriptive,1745,False
a light gray vase and some purple red and yellow flowers,descriptive,1746,False
Two laptops side by side with earphones in between.,spatial,1747,False
A woman on the beach area with a kite in front of her and people on the rock jetty behind her in the far distance.,spatial,1748,False
A small red apple and a orange on a white surface.,descriptive,1749,False
A man sitting back in a chair with his hand up in front of a laptop next to a woman. ,spatial,1750,False
An upside down picture where the only right side up thing is a sign.,spatial,1751,False
"A small brown, black and white dog is attached to a leash as it wears a costume.",descriptive,1752,False
A living room with a blue and white wall paper surround a purple and white couch.,descriptive,1753,False
A small black and white cow standing in the dark.,descriptive,1754,False
A bus traveling down a street next to a person walking across a street.,spatial,1755,False
A small green vase displays some small yellow blooms.,descriptive,1756,False
"Tourists stand on the side of a road outside of their bus, which has a stopped Jeep in front of it.",spatial,1757,False
A bus driving down a road next to a truck  near a forest of palm trees.,spatial,1758,False
"white airplane with yellow, pink and purple stripes",descriptive,1759,False
A close up of a tennis ball on the court with tennis players in the background.,spatial,1760,False
close up of two bears close to one another,spatial,1761,False
"A green, gold and white motorized airplane sitting in a large warehouse.",descriptive,1762,False
a black gold and white clock and two elevator doors,descriptive,1763,False
Vase with flowers make up the center piece for the table in front of the window,spatial,1764,False
A man stands next to a homemade sign with a bunch of cyclists standing around in the background next to their bicycles,spatial,1765,False
"A brown vase filled with yellow, purple and pink flowers on a table.",descriptive,1766,False
Large black and white dog lying comfortable on brown couch.,descriptive,1767,False
Black and white photo of old fashioned buses in a town square.,descriptive,1768,False
a street some light poles a blue bridge and a gray white and orange pole,descriptive,1769,False
A large red bus traveling past a small white van on a street.,descriptive,1770,False
"A red, yellow and blue fire hydrant sits by the road in the dark.",descriptive,1771,False
Two cows stand close to a fence near a fire hydrant.,spatial,1772,False
A group of workers standing near wet cement near the side walk.,spatial,1773,False
Cows have lined up close together near a wooden fence.,spatial,1774,False
a close up of people in a bus near windows on a dirt road,spatial,1775,False
a yellow fire hydrant sitting in the a small patch of green grass,descriptive,1776,False
"A room that appears small, bleak and barren holds a low bed with a quilt, a window with  blinds, and a small T.V.on a tiny stand.",descriptive,1777,False
A train traveling down tracks next to a rural country side.,spatial,1778,False
Two women standing up next to a cake that has fresh fruit on top and one of the women holding a knife and cutting the cake.,spatial,1779,False
a close up of a basket or bucket near a bath tub,spatial,1780,False
A man in a blue stripped dress shirt and a black and gold tie smiling. ,descriptive,1781,False
People standing outside near a parking lot  with ski equipment around them.,spatial,1782,False
Clock on outside of tower top with birds flying in the background,spatial,1783,False
A man too close to a TV playing a video game and a laptop screen glaring in the foreground.,spatial,1784,False
The truck is coming down the street and it has a motorcycle behind it and a bicycle beside it.,spatial,1785,False
man holding up phone close to the camera,spatial,1786,False
A small yellow and black toy bus made out of Legos.,descriptive,1787,False
a close up of a cow near a wooden bench in a field,spatial,1788,False
a close up of a person holding a book near a dog,spatial,1789,False
A close up of a TV remote with the TV in the background.,spatial,1790,False
a close up of a person standing up playing nintendo wii,spatial,1791,False
A young man wearing a red hair and red and white neck tie.,descriptive,1792,False
A large blue archway leading to a small blue door.,descriptive,1793,False
a close up of two people sitting close to one another,spatial,1794,False
a close up of a cat laying near a remote control,spatial,1795,False
a close up of a fire hydrant on a street near a fence,spatial,1796,False
a blue and white sign and a red and white sign,descriptive,1797,False
Overhead rail train tracks running side by side.,spatial,1798,False
a close up of a motorcycle parked near others,spatial,1799,False
Garbage left outside of a gate across the street fro homes. ,spatial,1800,False
a male in a brown shirt and a brown and white dog,descriptive,1801,False
