text,vision_label,_id,is_neutral
A close up of a fire hydrant with ice around it.,spatial,589,False
A small yellow and blue bird with a curved beak.,descriptive,590,False
A photo of a woman with long hair wearing a short blue dress rolling with a suitcase on a street with a crowd of people watching her.,descriptive,591,False
Small red and white twin engine airplane in flight. ,descriptive,592,False
"A fire hydrant painted red,, white, and blue are on the curb.",descriptive,593,False
A close up of a cat sitting on top of a laptop.,spatial,594,False
a close up of a cat on a bench near a field,spatial,595,False
a close up of a street sign with trees in the background,spatial,596,False
An open white toilet against a wall of white tiles and a black and white floor.,descriptive,597,False
"A near-ground shot shows logo-covered wall and chairs, fronted by a kid aping the tennis player in the tennis court before him, a woman, who is, positioned like a runner waiting for the starting gun, with her racquet gripped close to the ground.     ",spatial,598,False
"The large train is black, yellow, and red.",descriptive,599,False
A close up of a giraffes face with another in the background.,spatial,600,False
A close-up of a bad with a vase of flowers next to it.,spatial,601,False
Close up view of the under carriage of a jet in the sky with landing gear down.,spatial,602,False
a close up of a person playing with a frisbee near trees,spatial,603,False
a red and blue fire hydrant and some blue and white flowers,descriptive,604,False
a close up of a dog laying on the ground near an oven,spatial,605,False
"A small room features a small bed with a red, white and green blanket while pictures hang on the papered wall.",descriptive,606,False
Military man stand around outside with trucks in the background. ,spatial,607,False
a brown black and white cat and a blue container with some apples,descriptive,608,False
A brown haired boy lays on a blue and white checkered bed.,descriptive,609,False
"A large bathroom with golden walls, a pink sink, a pink commode and a pink bathtub.",descriptive,610,False
Kitchen shot of vintage white cabinets with silver and black appliances.,descriptive,611,False
Sheep standing around outside around things on the ground. ,spatial,612,False
A small pizza sits on a small circular plate.,descriptive,613,False
Some giraffes stand close to a fence near people. ,spatial,614,False
a close up of two elephants behind a fence,spatial,615,False
A brown dog and a black dog play with a yellow frisbee in a field.,descriptive,616,False
a small orange white gray and black kitten in a cup,descriptive,617,False
An action figure is one one side of an alarm clock and a Barbie doll is sleeping on top of a slipper that is on top of the alarm clock and another Barbie doll and Ken doll are holding on to the alarm clock.,spatial,618,False
A man is performing a skateboard trick too close to an overhead door.,spatial,619,False
A close up of a cow laying down with a chain around its neck.,spatial,620,False
A plain bathroom features a white toilet and sink and a beige bathtub.,descriptive,621,False
A close up picture of an elephant in front of a fence.,spatial,622,False
A group of giraffes roam free on a plain with tall brown grass and green bushes.,descriptive,623,False
The surfer with black and blue outfit rides the wave with his blue and white surfboard.,descriptive,624,False
"A red, green and yellow paper plate holding a piece of pizza.",descriptive,625,False
A boy in a blue and white shirt playing tennis on a brown tennis court.,descriptive,626,False
British flags fly overhead as double-decker buses and taxis move along below. ,spatial,627,False
a close up of a cat near a vase with flowers,spatial,628,False
a small round table with one chair and a black and white tablecloth.,descriptive,629,False
"A person sitting down with their legs stretched in front of them, on a skateboard ramp with a skateboard several feet in front of them.",spatial,630,False
a group of trains parked side by side next to a sidewalk,spatial,631,False
Four colorful pastries on black plates atop a white table.,descriptive,632,False
Three giraffes are in a grassy field.  One is standing tall and one is half bent over and the last one is bent all the way over and is eating grass.,descriptive,633,False
The bathroom is white with a blue countertop on a tiny vanity.,descriptive,634,False
a black and white cat in a green purse ,descriptive,635,False
a close up of a person sitting down eating something,spatial,636,False
a male in a yellow and black shirt and a yellow frisbee,descriptive,637,False
a close up of a basket or bucket near a bath tub,spatial,638,False
Small bathroom with square toilet and small stand in shower,descriptive,639,False
a close up of a goose with a water background,spatial,640,False
A child in a black and white soccer uniform standing by a blue and white soccer ball. ,descriptive,641,False
a close up of a cat near a couch on the ground,spatial,642,False
two white and blue vases and a white vase with a white and yellow flower,descriptive,643,False
a yellow and white bed in a small room,descriptive,644,False
A close up of a tennis racket with a guy in the background.,spatial,645,False
A close up of a person standing next to a horse.,spatial,646,False
a red and white bus and a woman in a blue coat,descriptive,647,False
A group of people standing around along the side of a body of water.,spatial,648,False
a close up of a street sign with a sky background,spatial,649,False
A restroom features black and white checkered flooring and two toilets of which has a black seat and lid and the other a white seat and lid.,descriptive,650,False
"A brown, black and white vase holding orange and white flowers.",descriptive,651,False
An image looking down train tracks outside with a stop sign next to them.,spatial,652,False
A man in black is leaning up against a yellow fire hydrant white a man in red has his arms crossed and another person with a hat on is waiting to cross the street.  ,descriptive,653,False
A double bed with a white bedspread and two red and white checkered pillowcases over the pillows.,descriptive,654,False
A small public bathroom looks neglected and unclean in black and white.,descriptive,655,False
A bathroom with large brown tiles and white fixtures,descriptive,656,False
"Side view of two standing elephants with a man on neck of one, both elephants with trunks to ground, in front of two long logs outside with hut and trees behind.",spatial,657,False
A white and tan bedroom with two blue beds and blue carpeting.,descriptive,658,False
The top of a cats head peaking above some covers and behind it a full bookcase.,spatial,659,False
A beige sink with a black and white cat in it.,descriptive,660,False
a close up of an old run down school bus,spatial,661,False
A narrow bathroom with a white toilet and a black towel hanging from a rack.,descriptive,662,False
a black bird flying away from a black and white dog,descriptive,663,False
"Tourists stand on the side of a road outside of their bus, which has a stopped Jeep in front of it.",spatial,664,False
a close up of a urinal with a drink on top,spatial,665,False
A big bright yellow school bus at night in the dark.,descriptive,666,False
A flower arrangement with pink and white flowers in a blue vase.,descriptive,667,False
a close up of a cat near a window,spatial,668,False
"Red, white and blue plane flying in a clear blue sky.",descriptive,669,False
"A man wearing a white shirt, dark blue shorts and white cap playing tennis.
",descriptive,670,False
"A line of colorful red, blue and green vases sit next to a large window.",descriptive,671,False
"A dark room has a black couch and gray, green, white and pink wall paper.",descriptive,672,False
Three police officers riding motorcycles side by side down a city street.,spatial,673,False
A picture of a small living room with black couch and brown entertainment unit.,descriptive,674,False
A man is in this living room sitting on his side and holding his hand up with a monitor next to him.,spatial,675,False
Small group of zebras walking in field of tall green grasses.,descriptive,676,False
a close up of a street sign on a pole near a building,spatial,677,False
A man standing next to a pile of rocks near a boat pulled up on shore by a mountain lake.,spatial,678,False
a small black brown and white cat a person and an apple,descriptive,679,False
a toilet next to a stand up shower with toilet paper near by,spatial,680,False
The white plate with a blue rim is displaying three square pieces of pizza.,descriptive,681,False
A pink vase is holding white and yellow small flowers.,descriptive,682,False
A hand points a black and white remote toward a large screen.,descriptive,683,False
a close up of a cat laying on top of a remote control,spatial,684,False
a close up of a sandwich on a plate near an apple ,spatial,685,False
"Small living room area with blue carpet, blue couches, and a small fireplace. ",descriptive,686,False
"A side view of a giraffe as it stares down at the ground, in the middle of the field.",spatial,687,False
a small black and white dog with a long tongue resting after a game of frisbee,descriptive,688,False
A black and white cat on a purple bed looking at a blue Swiss army knife.,descriptive,689,False
three people on bicycles lined up behind one another along a road.,spatial,690,False
"A blue vase on a table holding a large, pink flower. ",descriptive,691,False
"A living room with a black sofa, a black chair, and a flat screen TV.",descriptive,692,False
a close up of doughnuts on display behind a glass,spatial,693,False
A living room themed in green and dark blue with white and pink curtains on the windows. ,descriptive,694,False
The large kitchen with a silver and black refrigerator is organized.,descriptive,695,False
"A small toilet and trashcan across from a dirty sink in a very small, dirty bathroom.",descriptive,696,False
"A gray, white and brown sheep has long hair blowing in the breeze.",descriptive,697,False
A small brown bear being chased by a black bear,descriptive,698,False
A long stem yellow rose set in a tall blue vase,descriptive,699,False
a close up of a laptop next to a drink,spatial,700,False
a close up of a woman wearing jewelry and a boat in the background,spatial,701,False
A woman with short black hair and square glasses wears a tie and a gray shirt.,descriptive,702,False
a close up of a paper plate of food near a drink ,spatial,703,False
a red white and black truck and its driver,descriptive,704,False
A man riding a motorcycle down a street next to a  center divider.,spatial,705,False
"A  white teddy bear, yellow teddy bear brown teddy bear and a small yelllow teddy bear sitting in a row.",descriptive,706,False
A dog is crouched down beside a toilet looking up at the paper.,spatial,707,False
"A train runs along a railroad track, with another close behind.",spatial,708,False
a close up of a dog on brick surface near a door,spatial,709,False
a white blue and pink plate a fork and some chocolate cake,descriptive,710,False
a black brown and white cat an orange leash and a bicycle,descriptive,711,False
A kitchen with a refrigerator next to a stove top oven beneath a microwave.,spatial,712,False
a close up of a cat on a desk near a sandwich ,spatial,713,False
a close up of an elephant walking near trees,spatial,714,False
A small white plane flying through a light blue sky.,descriptive,715,False
A bike leaning up next to a street post in front of a restaurant. ,spatial,716,False
A bathroom with blue and white tiles and white cupboards and sink.,descriptive,717,False
a close up of two zebras near one another ,spatial,718,False
A high tower with a point on top has a clock near the top.,spatial,719,False
One cow standing near rocks lined next to the side of the road.,spatial,720,False
A doughnut sitting on top of a napkin next to a cut of coffee on top of a doughnut table cloth.,spatial,721,False
"A man in wearing glasses, a black shirt and large white tie standing in a dark room.",descriptive,722,False
A black and white cow eating a green apple,descriptive,723,False
A close up of a cat on a bed with a television on in the background.,spatial,724,False
A close up of a grey traffic light with a left turn sign under. ,spatial,725,False
Close-up side shot of a giraffe looking over a fence.,spatial,726,False
a close up of a cat paw near a book,spatial,727,False
A small brown bird sits on a green and red plant.,descriptive,728,False
"A large residential kitchen with white cabinetry, black counters and appliances, and wooden floors.",descriptive,729,False
A military truck traveling down a road near hill side.,spatial,730,False
Black and white of a white cat resting on a park bench.,descriptive,731,False
a white and green framed window on a red and white building,descriptive,732,False
A person lies face-up in bed next to a lap top computer. ,spatial,733,False
Black and white photo of a woman surfing a small wave.,descriptive,734,False
a close up of a person laying down with a stuffed animal,spatial,735,False
A grainy black and white photo of a small kitchen.,descriptive,736,False
Person outside with their arms around a horses neck and other horses around them.,spatial,737,False
A man is outside crouched down next to a tv on the street.,spatial,738,False
a close up of a giraffe with trees in the background,spatial,739,False
"Three colored beached chairs, yellow, red and blue by the ocean",descriptive,740,False
A close up of two kittens next to a window.,spatial,741,False
a close up of a neatly made bed with drawers underneath,spatial,742,False
A young and a woman sitting down outside with a laptop between them.,spatial,743,False
A surfer is doing a stunt on a surfboard while he rides the wave almost up-side down.,spatial,744,False
a brown white and black dog is walking ,descriptive,745,False
a close up of a train on a train track with a sky background,spatial,746,False
A blue and white vase holding red and yellow flowers.,descriptive,747,False
A white bed with white covers is in a white room.,descriptive,748,False
white and pink flowers in a dark vase sitting on a white table,descriptive,749,False
A man gets up close to a zebra to take a picture.,spatial,750,False
A tennis player in white wearing a white cap holds a red tennis racket.,descriptive,751,False
a close up ofa clock on top of a shelf ,spatial,752,False
a close up of a street sign with a sky background,spatial,753,False
a red blue and yellow bus and a green and white bus and some people,descriptive,754,False
Two horses standing in the snow side by side in front of a building.,spatial,755,False
"There is a red, white and blue fire hydrant on this street",descriptive,756,False
A man is going after a freebie while someone is lying down next to a bicycle reading the newspapers on the lawn  in front of a house.,spatial,757,False
Close up of tv remote controls on table near handwritten instructions.,spatial,758,False
A white and yellow train and a red and yellow train hooked to each other on a track. ,descriptive,759,False
close up view of one side of a motorcycle ,spatial,760,False
Suitcases lined up outside against a building with three men looking around.,spatial,761,False
"A yellow, blue, and white freight train on the train tracks.",descriptive,762,False
A man puts his face close to a cat lying down on a bed.,spatial,763,False
"An assortment of yellow, green and orange fruit on a white counter.",descriptive,764,False
A small blue bird is perched on a small limb.,descriptive,765,False
a close up of a refrigerator next to another one ,spatial,766,False
A large blue sign with white lettering adorns the concrete wall.,descriptive,767,False
A black brown cat with large whiskers looking at the camera.,descriptive,768,False
The small herd of cattle walk through the yellow patch of a large field.,descriptive,769,False
A black circular vase on a place mat holds a bouquet of pink and white orchids. ,descriptive,770,False
"A colorful bed with a red, gold, and purple bedspread.",descriptive,771,False
a close up of a fire hydrant near a city street ,spatial,772,False
three red black and white jets on a runway and a white truck,descriptive,773,False
a close up of a giraffe behind a fence ,spatial,774,False
"A mom kissing her baby girl beneath a clear umbrella is the foreground, while the background is a chalkboard drawing of a dog standing on grass in the rain.",spatial,775,False
"A vegetable stand from very close up, Broccoli is right in the cameras view.",spatial,776,False
A man with his arm up in front of his chest and a frisbee in the air near him.,spatial,777,False
A black and white cat on the hood of a white car.,descriptive,778,False
"A giraffe reaches its head past the top of its enclosure to allow a young girl to stroke it, while a woman that is standing in front of several other people looking inside the enclosure takes a picture.  ",spatial,779,False
A man wearing glasses brushing his teeth up close to the camera ,spatial,780,False
A bus is pulled up to the side of the road to pick up people.,spatial,781,False
"Two green, blue and yellow birds have long beaks and sit together on a branch.",descriptive,782,False
A small kitchen with green and yellow cabinets and black stove and refrigerator.,descriptive,783,False
"Baseball players siting in a dugout area look out at home base, which rests in the foreground, and shows a  batter finishing his swing, a crouching catcher and an umpire right behind him. ",spatial,784,False
A close-up of two surf boards leaning against each other in front of the ocean.,spatial,785,False
a couple of people walk down a side walk next to a street ,spatial,786,False
A long green and yellow freight train on train tracks.,descriptive,787,False
a blue gray and white stuffed pig and he is holding a doll,descriptive,788,False
Red bricked building with white trim and large clock. ,descriptive,789,False
"Blue, yellow and green cake on a silver sheet.",descriptive,790,False
a black gray orange and white cat in a car,descriptive,791,False
Two skate boards sitting side by side next to each other on a floor.,spatial,792,False
A close up picture of a vase in front of 6 other vases.,spatial,793,False
a close up of many oranges piled on top of each other,spatial,794,False
A train traveling very close to houses next to a street.,spatial,795,False
A white cat with brown ears and tail sitting on a yellow and white blanket.,descriptive,796,False
A large white bus sitting in a dark parking lot.,descriptive,797,False
A police car turning right down a street next to pedestrians.,spatial,798,False
A large white bathroom with a vase filled with yellow flowers.,descriptive,799,False
"A large white, yellow and red bus driving down a street.",descriptive,800,False
a close up of a motorcycle parked near a building,spatial,801,False
"A red, yellow and blue fire hydrant sits by the road in the dark.",descriptive,802,False
Large black and white dog lying comfortable on brown couch.,descriptive,803,False
"A street sign with the name of a street on it, and next to it is a post with various names up and down the post.",spatial,804,False
Two canoes going up the river close to the shore.,spatial,805,False
Two men in blue and yellow shirts and white shorts with tennis rackets.,descriptive,806,False
a black white and gray cat  a pillow and a white blanket ,descriptive,807,False
Three trucks with lawn mowers in the bed and people near by are parked side-by-side. ,spatial,808,False
Three giraffe stand near each other close to a fence.,spatial,809,False
There is a picture of a traffic sign with north and south arrows in the foreground and a graveyard in the back ground on a projectable slide.,spatial,810,False
A bus pulls toward the sidewalk behind a cyclist as a line of cars makes their way down the street on the other side.,spatial,811,False
Small clean white kitchen area with dark appliances.,descriptive,812,False
"A peafowl with colors of blue, green, yellow, and black.",descriptive,813,False
a close up of a hot dog in front of a car,spatial,814,False
"One person stands on top of a car while two people stand next to the car, looking up at the person.",spatial,815,False
A large white and red Avianca airplane is shown.,descriptive,816,False
Large dirty stove in green and brown kitchen.,descriptive,817,False
Cows have lined up close together near a wooden fence.,spatial,818,False
A black and white picture of a small airplane parked at the airport,descriptive,819,False
"Three beds huddled close together, with sheets on top.",spatial,820,False
A large bathroom with blue and white tiles on the floor with a large bathtub.,descriptive,821,False
a close up of a bird on a beach near the water,spatial,822,False
Blue shower curtains in a large white bathroom ,descriptive,823,False
Four motorcycles sit parked side by side next to a closed off street.,spatial,824,False
The small plane is black with red tips.,descriptive,825,False
"A yellow vase with two pink, purple and white flowers in it.",descriptive,826,False
A black and white cat lays on its back near a black and white dog on a pink blanket.,descriptive,827,False
a close up of a bull with a truck in the background,spatial,828,False
Man sets up camping equipment while his two dogs are tied up next to him. ,spatial,829,False
a close up of a dog laying on a couch near a remote controller,spatial,830,False
the clean bathroom is painted red and white.,descriptive,831,False
A close up of a giraffe with trees in the background.,spatial,832,False
a close up of a baseball player bending down with a glove,spatial,833,False
Two zebra standing side by side next to a pile of stones.,spatial,834,False
a close up of a horse in a field with a sky background,spatial,835,False
A close of up oranges with people standing around fruit stands.,spatial,836,False
a close up of a cat sitting very close to a tv,spatial,837,False
a gray black and white cat is sleeping on a blue couch,descriptive,838,False
A round green bed in a room with wooden walls has white sheets.,descriptive,839,False
a red white and black truck some lights and a bush,descriptive,840,False
"People enjoying a large, thin crust, square pizza with various toppings",descriptive,841,False
"Several objects are in a corner with patriotic colors of red, white and blue.",descriptive,842,False
A man wearing an orange life vest carrying a yellow display with large metal bowl full of bananas.,descriptive,843,False
A small bathroom with a white toilet and vanity and black and white tiled floor.,descriptive,844,False
A giant upside down baseball bat leaning up against the side of a building.,spatial,845,False
a close up of different layered food with a blurry background,spatial,846,False
A white dog wears a blue bow tie while attached on a pink leash.,descriptive,847,False
a close up of a person next to a horse,spatial,848,False
A lady with brown hair and a brown short wearing a pink polka dotted tie.,descriptive,849,False
a close up of a toilet with a roll of toilet paper in the foreground,spatial,850,False
"A man with an orange and pink surfboard, a man in a white shirt and jeans and a woman in gray and black with a white surfboard cross a street in the crosswalk.",descriptive,851,False
a white pot with orange red purple and white flowers,descriptive,852,False
a black suitcase a red bag and a pink and black bag,descriptive,853,False
a child in a blue jacket on skis and two blue green and white street signs,descriptive,854,False
A lone bench next to a trail high up on a hill side.,spatial,855,False
close up of a box tied with a bow sitting on the top of a toilet tank in a bathroom,spatial,856,False
a close up of a street sign with buildings in the background,spatial,857,False
a gray white and black clock and a gray white and brown building,descriptive,858,False
A very large blue and white vase sitting on a purple counter.,descriptive,859,False
A pretty room has a white bed with white pillows and a large window.,descriptive,860,False
A black and white dog wrapped in a white blanket.,descriptive,861,False
a close up of a giraffe with a tree in the background,spatial,862,False
A bus parks close to a truck in front of a church.,spatial,863,False
Overhead view of traffic lights on pole above top of building. ,spatial,864,False
A horizontal close up view of a park bench.,spatial,865,False
A large black and white airplane readies for take off,descriptive,866,False
A girl balancing an over sized tennis ball on a racket while a man and woman walk side by side behind her.,spatial,867,False
a bathroom with some white and black towels and yellow and red  flowers ,descriptive,868,False
A very tall white clock tower sitting under a blue sky.,descriptive,869,False
A old black and white photo of a small air plane,descriptive,870,False
"Two people stand near a picture window, with one person inside, and the other person outside on a patio.",spatial,871,False
a close up of a cake on a table near a cup,spatial,872,False
A upside down picture of a stop which is right side up.,spatial,873,False
A large yellow and brown boat floating on a body of water.,descriptive,874,False
A view looking up the side of a clock tower with crosses on the top.,spatial,875,False
The subway train rolls along the tracks beneath the cables and beams overhead.,spatial,876,False
Two pictures side by side of a man holding a tennis racket in front of a tennis ball. ,spatial,877,False
A person in red and black reaching for a person in white and black who has a Frisbee.,descriptive,878,False
a close up of a person opening an appliance and looking inside,spatial,879,False
a close up of a street sign near a building,spatial,880,False
Small bathroom area with a blue and white shower curtain hanging. ,descriptive,881,False
"On wet black pavement, holding a hula hoop and red umbrella, stands a woman wearing a red one-piece dress, white purse and red shoes.",descriptive,882,False
